{
  "schemaVersion": 1,
  "asOf": "2026-08-11",
  "status": "activation_contract_ready_human_coverage_gated",
  "purpose": "Define the accountable people, protected escalation route, jurisdictional boundary, response coverage, restricted records, exercises, and fail-closed controls required before Mythical promotes free-text intake or connects support, research, community, or social automation.",
  "decisionRefs": ["D-012"],
  "riskRefs": ["R-001", "R-004", "R-006", "R-009", "R-011", "R-013"],
  "workflowRefs": ["A-004", "A-005", "A-020", "A-025", "A-026", "A-029", "A-033", "A-035"],
  "authority": {
    "inboxAccessAuthorized": false,
    "socialAccessAuthorized": false,
    "restrictedCaseAccessAuthorized": false,
    "routeConfigurationAuthorized": false,
    "alertDeliveryAuthorized": false,
    "automatedClassificationAuthorized": false,
    "responseDraftingAuthorized": false,
    "externalResponseAuthorized": false,
    "intakePromotionAuthorized": false,
    "researchRecruitmentAuthorized": false,
    "caseOrIncidentWriteAuthorized": false,
    "externalActionAuthorized": false,
    "conversationIsAuthorization": false
  },
  "operatingBoundary": {
    "appliesTo": ["hello_inbox", "parents_inbox", "future_forms", "reviews", "social_messages", "research_sessions"],
    "restrictedQueues": ["Q0", "Q1"],
    "q0RequiresNamedHuman": true,
    "q1RequiresNamedHumanOrSpecialist": true,
    "directMinorContactPermitted": false,
    "automatedSubstantiveRestrictedResponsePermitted": false,
    "agentMayContactEmergencyServices": false,
    "agentMayMakeMandatoryReportingDecision": false,
    "restrictedContentInSharedRepositoryPermitted": false,
    "routeValueInSharedRepositoryPermitted": false,
    "personalContactDetailsInSharedRepositoryPermitted": false,
    "uncertaintyRoutesUpward": true,
    "responseSpeedOutranksSafety": false
  },
  "humanCoverage": {
    "primary": { "status": "unassigned", "accountablePersonRef": null, "acceptanceRecorded": false, "trainingOrCompetenceReviewed": false },
    "backup": { "status": "unassigned", "accountablePersonRef": null, "acceptanceRecorded": false, "trainingOrCompetenceReviewed": false },
    "urgentExceptionRecipient": { "status": "unassigned", "accountablePersonRef": null, "acceptanceRecorded": false },
    "separationPossible": false,
    "geographicScope": [],
    "jurisdictionsReviewed": [],
    "coverageTimezone": null,
    "coverageDays": [],
    "coverageStartLocal": null,
    "coverageEndLocal": null,
    "outOfHoursProcedureRef": null,
    "coverageApproved": false
  },
  "responseTargets": {
    "q0HumanAcknowledgementMinutes": null,
    "q0HumanAssessmentMinutes": null,
    "q1HumanAcknowledgementHours": null,
    "ordinarySupportTargetHours": null,
    "targetsApproved": false,
    "targetsTested": false
  },
  "protectedRoutesAndRecords": {
    "urgentRouteType": null,
    "urgentRouteReference": null,
    "urgentRouteValueStoredHere": false,
    "urgentRouteConfigured": false,
    "urgentRouteTested": false,
    "backupRouteReference": null,
    "backupRouteValueStoredHere": false,
    "backupRouteConfigured": false,
    "backupRouteTested": false,
    "restrictedIncidentSystemReference": null,
    "restrictedIncidentSystemConfigured": false,
    "minimumAlertPayloadApproved": false,
    "alertPayloadMayContainMessageBody": false,
    "alertPayloadMayContainAttachment": false,
    "accessMatrixApproved": false,
    "retentionAndDeletionApproved": false,
    "auditLogConfigured": false,
    "killSwitchConfigured": false,
    "routeRecoveryOwnerRef": null
  },
  "professionalReview": {
    "jurisdictionalSafeguardingPolicyReference": null,
    "privacyAndDataProtectionReviewCompleted": false,
    "childSafetyReviewCompleted": false,
    "mandatoryReportingRulesReviewed": false,
    "lawEnforcementOrEmergencyEscalationRulesReviewed": false,
    "evidencePreservationRulesReviewed": false,
    "accessRetentionDeletionRulesReviewed": false,
    "reviewersNamed": false,
    "reviewCompleted": false
  },
  "currentSyntheticEvidence": {
    "workflowRef": "A-004",
    "fixtureRef": "docs/company/support/synthetic-evaluation.json",
    "caseCount": 17,
    "restrictedCaseCount": 12,
    "restrictedRecall": 1,
    "q0ExactRecall": 1,
    "unauthorizedSendsOrToolActions": 0,
    "prohibitedInformationRequests": 0,
    "syntheticOnly": true,
    "openWorldSafetyProven": false,
    "multilingualCoverageSufficient": false,
    "promotionEligible": false
  },
  "requiredExercises": [
    { "id": "SGX-001", "scenario": "Q0 message reaches the primary through a minimum-detail protected alert", "status": "not_run", "passed": false },
    { "id": "SGX-002", "scenario": "Primary is unavailable and the protected backup route takes over inside the approved target", "status": "not_run", "passed": false },
    { "id": "SGX-003", "scenario": "Urgent route fails and the documented out-of-hours or route-failure procedure activates", "status": "not_run", "passed": false },
    { "id": "SGX-004", "scenario": "Duplicate delivery is detected without losing the original restricted event", "status": "not_run", "passed": false },
    { "id": "SGX-005", "scenario": "Unexpected child or personal data stays out of shared logs, drafts, and evidence records", "status": "not_run", "passed": false },
    { "id": "SGX-006", "scenario": "Prompt injection or malicious attachment cannot trigger tools, disclosure, or substantive response", "status": "not_run", "passed": false },
    { "id": "SGX-007", "scenario": "Unknown jurisdiction or uncertain severity routes upward without an automated legal or reporting decision", "status": "not_run", "passed": false },
    { "id": "SGX-008", "scenario": "Inbox, classifier, alert route, and future automation can be disabled and access revoked", "status": "not_run", "passed": false },
    { "id": "SGX-009", "scenario": "Restricted incident record access, retention, deletion, and recovery controls behave as approved", "status": "not_run", "passed": false },
    { "id": "SGX-010", "scenario": "A human-reviewed multilingual and ambiguous-case set meets the approved restricted recall threshold", "status": "not_run", "passed": false }
  ],
  "activationGates": [
    { "id": "SG-G01", "gate": "D-012 records the safeguarding operating decision and does not itself authorize connection", "satisfied": false },
    { "id": "SG-G02", "gate": "Primary accountable person accepts the role and competence or training is reviewed", "satisfied": false },
    { "id": "SG-G03", "gate": "Backup accountable person accepts the role and competence or training is reviewed", "satisfied": false },
    { "id": "SG-G04", "gate": "Urgent exception recipient and route recovery owner are confirmed", "satisfied": false },
    { "id": "SG-G05", "gate": "Geographic scope, applicable jurisdictions, and professional review requirements are recorded", "satisfied": false },
    { "id": "SG-G06", "gate": "Coverage timezone, days, hours, out-of-hours procedure, and Q0/Q1 targets are approved", "satisfied": false },
    { "id": "SG-G07", "gate": "Protected primary and backup route references are configured without route values entering this repository", "satisfied": false },
    { "id": "SG-G08", "gate": "Restricted incident system, access matrix, retention, deletion, audit, and recovery are approved", "satisfied": false },
    { "id": "SG-G09", "gate": "Minimum-detail alert payload is approved and excludes message bodies and attachments", "satisfied": false },
    { "id": "SG-G10", "gate": "Privacy, child-safety, jurisdictional, reporting, emergency, and preservation reviews are complete", "satisfied": false },
    { "id": "SG-G11", "gate": "All ten required synthetic and operational exercises pass with independent review", "satisfied": false },
    { "id": "SG-G12", "gate": "Open-world multilingual evaluation set meets approved restricted recall and action thresholds", "satisfied": false },
    { "id": "SG-G13", "gate": "Kill switch, access revocation, route failure, recovery, and intake pause procedures pass", "satisfied": false },
    { "id": "SG-G14", "gate": "Knowledge base and ordinary-response grounding are approved for any draft-only pilot", "satisfied": false },
    { "id": "SG-G15", "gate": "A separate digest-bound approval authorizes only the exact restricted label-and-alert pilot", "satisfied": false },
    { "id": "SG-G16", "gate": "Pilot reconciliation owner, incident review cadence, and automatic expiry are recorded", "satisfied": false }
  ],
  "downstreamDependencies": [
    { "id": "SGD-001", "dependentRef": "A-004", "capability": "Restricted support classification and alert pilot", "ready": false },
    { "id": "SGD-002", "dependentRef": "A-029", "capability": "Adult research safeguarding escalation gate", "ready": false },
    { "id": "SGD-003", "dependentRef": "A-020", "capability": "Support and community relationship operation", "ready": false },
    { "id": "SGD-004", "dependentRef": "A-026", "capability": "Outward launch waves involving free-text intake", "ready": false },
    { "id": "SGD-005", "dependentRef": "A-033", "capability": "Public channel moderation and safeguarding coverage", "ready": false }
  ],
  "kevinInputBrief": [
    { "id": "SGI-001", "input": "Primary safeguarding accountable person or role reference and confirmation that they accept the role", "storeContactDetailsHere": false, "provided": false },
    { "id": "SGI-002", "input": "Backup safeguarding accountable person or role reference and confirmation that they accept the role", "storeContactDetailsHere": false, "provided": false },
    { "id": "SGI-003", "input": "Urgent route type, protected route reference, urgent recipient, and recovery owner without the route value or credentials", "storeContactDetailsHere": false, "provided": false },